{
  "schema_version": "v0.1",
  "generated_at": "2026-03-05T13:30:00+09:00",
  "scenario": {
    "id": "baseline",
    "name": "ベースライン",
    "description": "パラメータ変動を加えない現行方針"
  },
  "horizon_days": 7,
  "currency": "JPY",
  "kpi": {
    "min_cash": 920000,
    "first_cash_shortfall_date": null,
    "total_stockout_qty": 6,
    "stockout_rate": 0.021,
    "days_on_hand_avg": 12.4
  },
  "alerts": [
    {
      "code": "stockout_rate_breach",
      "severity": "warn",
      "date": "2026-03-08",
      "item_id": "A001",
      "message": "欠品率がしきい値 2.0% を超過しました"
    }
  ],
  "cash_series": [
    {"date": "2026-03-05", "cash": 1000000, "inflow": 120000, "outflow": 85000},
    {"date": "2026-03-06", "cash": 980000, "inflow": 90000, "outflow": 110000},
    {"date": "2026-03-07", "cash": 960000, "inflow": 70000, "outflow": 90000},
    {"date": "2026-03-08", "cash": 940000, "inflow": 60000, "outflow": 80000},
    {"date": "2026-03-09", "cash": 930000, "inflow": 75000, "outflow": 85000},
    {"date": "2026-03-10", "cash": 920000, "inflow": 82000, "outflow": 92000},
    {"date": "2026-03-11", "cash": 925000, "inflow": 100000, "outflow": 95000}
  ],
  "inventory_series": [
    {"date": "2026-03-05", "item_id": "A001", "on_hand": 12, "on_order": 20, "demand": 8, "sold": 8, "stockout": 0},
    {"date": "2026-03-06", "item_id": "A001", "on_hand": 7, "on_order": 20, "demand": 6, "sold": 6, "stockout": 0},
    {"date": "2026-03-07", "item_id": "A001", "on_hand": 3, "on_order": 20, "demand": 7, "sold": 3, "stockout": 4},
    {"date": "2026-03-08", "item_id": "A001", "on_hand": 0, "on_order": 20, "demand": 2, "sold": 0, "stockout": 2}
  ]
}
